{
  "metadata": {
    "title": "Guillermo Mena | Frontend Developer",
    "description": "Developer with 5+ years of professional experience, specializing in frontend development with React, JavaScript and TypeScript."
  },
  "summary": {
    "name": "Guillermo Mena",
    "title": "Frontend Developer from Madrid, Spain",
    "description": "Developer with [5+ years of experience|violet], specializing for the past two years in [frontend|orange] development with [React|red], [JavaScript|amber] and [TypeScript|emerald], and with previous experience in game engineering with Unity.\nI also apply my expertise to indie projects, where I've scaled my own [Flutter|blue] apps to 370,000+ downloads while experimenting with a broad range of other technologies.",
    "links": [
      {
        "label": "CV",
        "url": "https://drive.proton.me/urls/MWPD5ASFMM#dHGSHgOjK4xK"
      },
      {
        "label": "Email",
        "url": "mailto:guille.mena@protonmail.com"
      },
      {
        "label": "LinkedIn",
        "url": "https://linkedin.com/in/menito"
      },
      {
        "label": "GitHub",
        "url": "https://github.com/menit0"
      }
    ]
  },
  "work": {
    "name": "Work Experience",
    "experiences": [
      {
        "title": "Frontend Developer",
        "date": "Jul 2024 - Present",
        "place": {
          "name": "Sngular",
          "url": "https://linkedin.com/company/sngular"
        },
        "icon": "sngular.webp",
        "description": "Engineered payment modules and scalable UI components for Inditex's internal ecosystem using React and JavaScript. Optimized the integration of REST APIs while ensuring platform stability through a testing architecture based on Vitest and Cypress."
      },
      {
        "title": "Unity Developer",
        "date": "Jul 2022 - Jul 2024",
        "place": {
          "name": "Sngular",
          "url": "https://linkedin.com/company/sngular"
        },
        "icon": "sngular.webp",
        "description": "Led the development of immersive VR and interactive museum installations, integrating Unity with headless WordPress architectures for dynamic data management. Built internal tools and reusable components to automate workflows and streamline development."
      },
      {
        "title": "Unity Developer",
        "date": "Feb 2021 - Jul 2022",
        "place": {
          "name": "Freelance",
          "url": ""
        },
        "icon": "freelance.webp",
        "description": "Delivered interactive applications for enterprise clients across various sectors, specializing in high-performance multiplatform applications. Engineered real-time multiplayer social spaces using Photon Engine and provided post-delivery technical support and maintenance."
      }
    ]
  },
  "education": {
    "name": "Education",
    "experiences": [
      {
        "title": "Degree in Video Game Development and Design",
        "date": "2014 - 2020",
        "place": {
          "name": "Rey Juan Carlos University",
          "url": "https://linkedin.com/school/universidad-rey-juan-carlos/"
        },
        "icon": "urjc.webp"
      }
    ]
  },
  "skills": {
    "name": "Skills",
    "items": [
      "React",
      "TypeScript",
      "JavaScript",
      "Next.js",
      "Angular",
      "Astro",
      "HTML",
      "CSS",
      "Sass",
      "Tailwind CSS",
      "Redux",
      "Zustand",
      "Testing Library",
      "Vitest",
      "Jest",
      "Cypress",
      "Vite",
      "Webpack",
      "Supabase",
      "Git",
      "Jira",
      "Flutter",
      "Dart",
      "Unity",
      "C#"
    ]
  },
  "mainProjects": {
    "name": "Main Projects",
    "projects": [
      {
        "name": "Inditex Back Office",
        "thumbnail": "project_inditex.webp",
        "url": "https://inditex.com",
        "date": "Jul 2024 - Present",
        "description": "Worked on front-end features and interfaces aimed to improve an Inditex internal platform, used to manage all payments made in Inditex online stores worldwide.",
        "skills": [
          "React",
          "JavaScript",
          "Redux",
          "HTML",
          "Sass",
          "Vitest",
          "Cypress"
        ]
      },
      {
        "name": "Real Madrid Museum",
        "thumbnail": "project_realmadrid.webp",
        "url": "https://realmadrid.com/sites/tour-bernabeu",
        "date": "Apr 2023 - Jul 2024",
        "description": "Developed interactives and VR experiences for the official Real Madrid Museum. My work also focused on create reusable components to streamline team development.",
        "skills": ["Unity", "C#"]
      },
      {
        "name": "Qatar Olympic and Sports Museum",
        "thumbnail": "project_qatar.webp",
        "url": "https://sngular.com/success-stories/11/faster-taller-stronger-and-more-innovative",
        "date": "Feb 2021 - Oct 2022",
        "description": "Main programmer of interactive experiences for the Qatar Olympic and Sports Museum. This included 3D minigames, motion detection with Kinect and interactive panels with touchscreens.",
        "skills": ["Unity", "C#"]
      },
      {
        "name": "SABIC Digital Experience Center",
        "thumbnail": "project_sabic.webp",
        "url": "https://sabic.com/en",
        "date": "Oct 2022 - Apr 2023",
        "description": "Main programmer of multi-device interactives for the headquarters of SABIC, a leading chemical company, including interactive tables, touch screens and AR experiences.",
        "skills": ["Unity", "C#"]
      },
      {
        "name": "Exhibify",
        "thumbnail": "project_exhibify.webp",
        "url": "https://exhibify.net",
        "date": "Aug 2021 - Mar 2022",
        "description": "I developed a virtual exhibition creation tool for Exhibify, a platform that allows artists to create custom exhibitions to showcase and sell their works.",
        "skills": ["Unity", "C#"]
      },
      {
        "name": "Color Rush",
        "thumbnail": "project_naolito.webp",
        "url": "https://naolito.com",
        "date": "May 2022 - Jul 2022",
        "description": "I developed a prototype 2D runner mobile game commissioned by Naolito Animation Studios, which included all the main mechanics and a level editor to facilitate the creation of new levels by the Naolito team.",
        "skills": ["Unity", "C#"]
      },
      {
        "name": "Uttopion",
        "thumbnail": "project_uttopion.webp",
        "url": "https://uttopion.es",
        "date": "Feb 2021 - Dec 2021",
        "description": "I worked on incorporating multiplayer features and content updates for Uttopion, a metaverse where users can attend concerts, parties and other events in a 3D environment.",
        "skills": ["Unity", "C#", "Photon"]
      },
      {
        "name": "TodoLibros3D",
        "thumbnail": "project_todolibros3d.webp",
        "url": "https://todolibros3d.com",
        "date": "Feb 2022 - Mar 2022",
        "description": "I added multiplayer features to TodoLibros3D, a virtual library where users could now interact with each other in real time by creating their own custom avatars and via text chat.",
        "skills": ["Unity", "C#", "Photon"]
      }
    ]
  },
  "sideProjects": {
    "name": "Side Projects",
    "projects": [
      {
        "name": "GameResources.dev",
        "thumbnail": "project_gameresources.webp",
        "url": "https://gameresources.dev",
        "date": "2026",
        "description": "A directory of useful tools and resources for each field involved in game development, including code, 3D assets, marketing, or audio, among others.",
        "skills": ["Astro", "TypeScript", "HTML", "CSS"]
      },
      {
        "name": "WattLuz",
        "thumbnail": "project_wattluz.webp",
        "url": "https://play.google.com/store/apps/details?id=com.menito.precioluz",
        "date": "2024",
        "description": "Mobile app to check the electricity price in Spain in real time, with interactive graphs and customizable notifications to help you save on your electricity bill.",
        "skills": ["Flutter", "Dart"]
      },
      {
        "name": "Nanito Launcher",
        "thumbnail": "project_nanitolauncher.webp",
        "url": "https://play.google.com/store/apps/details?id=com.menito.minimallauncher",
        "date": "2024",
        "description": "Minimalist launcher for Android that offers a distraction-free user experience, with a clean design and a customizable interface.",
        "skills": ["Flutter", "Dart"]
      },
      {
        "name": "Chupito",
        "thumbnail": "project_chupito.webp",
        "url": "https://play.google.com/store/apps/details?id=com.menito.appcohol",
        "date": "2020",
        "description": "Mobile app that includes challenges and questions to liven up any party. With over 370,000 downloads, it has become one of the most popular apps in its category in several countries.",
        "skills": ["Flutter", "Dart"]
      },
      {
        "name": "Pincho.io",
        "thumbnail": "project_pinchoio.webp",
        "url": "https://youtube.com/watch?v=eDQVwSZA6f0",
        "date": "2019",
        "description": "Mobile game inspired by Agar.io, where players must attack others to grow and be the biggest in the game. The game reached +5,000 downloads on Google Play, but is currently no longer available.",
        "skills": ["Unity", "C#"]
      }
    ]
  }
}
